{
  "$schema": "../../schema/open-ir-remote-v1.schema.json",
  "format": "open-ir-remote",
  "format_version": "1.0.0",
  "record_kind": "example",
  "id": "oir:exampleco:luma-4:global",
  "updated": "2026-09-12",
  "remote": {
    "name": "ExampleCo Luma 4 Remote",
    "manufacturer": "ExampleCo",
    "model": "Luma 4",
    "variant": "global",
    "device_types": [
      "lighting"
    ]
  },
  "locale": "en",
  "defaults": {
    "protocol": "NEC",
    "carrier_hz": 38000,
    "duty_cycle": 0.33
  },
  "commands": [
    {
      "id": "power.toggle",
      "labels": {
        "en": "Power"
      },
      "action": "toggle",
      "signals": [
        {
          "kind": "decoded",
          "protocol": "NEC",
          "parameters": {
            "address_hex": "0x00",
            "command_hex": "0x45"
          },
          "source_complete": true,
          "primary": true
        }
      ]
    },
    {
      "id": "brightness.up",
      "labels": {
        "en": "Brightness +"
      },
      "action": "increment",
      "signals": [
        {
          "kind": "raw",
          "carrier_hz": 38000,
          "duty_cycle": 0.33,
          "intro_us": [
            9000,
            -4500,
            560,
            -560,
            560,
            -1690,
            560,
            -40000
          ],
          "repeat_us": [
            9000,
            -2250,
            560,
            -40000
          ],
          "source_complete": true,
          "primary": true
        }
      ]
    }
  ],
  "provenance": [
    {
      "source_type": "contributor-capture",
      "source_path": "Fictional documentation example",
      "imported_at": "2026-09-12",
      "rights": "CC0-1.0",
      "notes": "Documentation only; not a real remote."
    }
  ],
  "validation": {
    "status": "device-tested",
    "tested_at": "2026-09-12",
    "tester": "Example contributor",
    "evidence": [
      "Fictional documentation example."
    ],
    "issues": []
  }
}
