{"$schema":"https://jameswalton-tech.github.io/Open-IR-Remote/schema/open-ir-remote-v1.schema.json","format":"open-ir-remote","format_version":"1.0.0","record_kind":"canonical","id":"oir:fosi-audio:zd3:default","updated":"2026-09-13","remote":{"name":"Remote for Fosi Audio ZD3","manufacturer":"Fosi Audio","model":"Unknown","variant":"default","device_types":["audio-system"],"controlled_devices":[{"manufacturer":"Fosi Audio","model":"ZD3","device_type":"audio-system"}]},"locale":"en","commands":[{"id":"power","labels":{"en":"Power"},"signals":[{"kind":"decoded","parameters":{"address_hex":"0x000001FA","command_hex":"0x0000FA05"},"primary":true,"source_complete":true}]},{"id":"mute","labels":{"en":"Mute"},"signals":[{"kind":"decoded","parameters":{"address_hex":"0x000001FA","command_hex":"0x0000FD02"},"primary":true,"source_complete":true}]},{"id":"vol.up","labels":{"en":"Vol_up"},"signals":[{"kind":"decoded","parameters":{"address_hex":"0x000001FA","command_hex":"0x0000FC03"},"primary":true,"source_complete":true}]},{"id":"vol.dn","labels":{"en":"Vol_dn"},"signals":[{"kind":"decoded","parameters":{"address_hex":"0x000001FA","command_hex":"0x0000F807"},"primary":true,"source_complete":true}]},{"id":"play.pause","labels":{"en":"Play_pause"},"signals":[{"kind":"decoded","parameters":{"address_hex":"0x000001FA","command_hex":"0x0000F50A"},"primary":true,"source_complete":true}]},{"id":"next","labels":{"en":"Next"},"signals":[{"kind":"decoded","parameters":{"address_hex":"0x000001FA","command_hex":"0x0000F906"},"primary":true,"source_complete":true}]},{"id":"prev","labels":{"en":"Prev"},"signals":[{"kind":"decoded","parameters":{"address_hex":"0x000001FA","command_hex":"0x0000FB04"},"primary":true,"source_complete":true}]},{"id":"coax","labels":{"en":"Coax"},"signals":[{"kind":"decoded","parameters":{"address_hex":"0x000001FA","command_hex":"0x0000F609"},"primary":true,"source_complete":true}]},{"id":"optical","labels":{"en":"Optical"},"signals":[{"kind":"decoded","parameters":{"address_hex":"0x000001FA","command_hex":"0x0000F708"},"primary":true,"source_complete":true}]},{"id":"usb","labels":{"en":"USB"},"signals":[{"kind":"decoded","parameters":{"address_hex":"0x000001FA","command_hex":"0x0000EE11"},"primary":true,"source_complete":true}]},{"id":"hdmi","labels":{"en":"HDMI"},"signals":[{"kind":"decoded","parameters":{"address_hex":"0x000001FA","command_hex":"0x0000EC13"},"primary":true,"source_complete":true}]},{"id":"bluetooth","labels":{"en":"Bluetooth"},"signals":[{"kind":"decoded","parameters":{"address_hex":"0x000001FA","command_hex":"0x0000EA15"},"primary":true,"source_complete":true}]},{"id":"display.toggle","labels":{"en":"Display_toggle"},"signals":[{"kind":"decoded","parameters":{"address_hex":"0x000001FA","command_hex":"0x0000FE01"},"primary":true,"source_complete":true}]}],"provenance":[{"source_type":"upstream-reference","source_path":"https://github.com/Lucaslhm/Flipper-IRDB/blob/d126fb1b6f1e114c52b4a8c19839ea65e3a9c24d/Audio_and_Video_Receivers/Fosi_Audio/Fosi_Audio_ZD3.ir","source_revision":"d126fb1b6f1e114c52b4a8c19839ea65e3a9c24d","imported_at":"2026-09-13","rights":"CC0-1.0","notes":"Flipper-IRDB contributors. File introduced in 95dbd0f6cde9587fa9d3ea337eebbefbd4035e33 after the upstream CC0 cutoff. Original source.ir SHA-256: 99371db1de55e84afe8578af78015b584c082bac956abe32b597414fd3a616f4. Source comments are preserved in source.ir. No image rights are asserted."}],"validation":{"status":"imported-unverified","issues":["Imported decoded parameters have not been tested on hardware by Open IR contributors. Protocol names and packed parameters follow the source Flipper convention; target adapters must support that convention. No carrier frequency was measured or inferred.","The source identifies the controlled equipment, not a printed handset model number."]},"extensions":{"flipper":{"file_version":1,"parameter_encoding":"Four little-endian source bytes converted to unsigned numeric hexadecimal; protocol names unchanged."}},"defaults":{"protocol":"NECext"}}
