{
  "$schema": "../../../../schema/open-ir-remote-v1.schema.json",
  "format": "open-ir-remote",
  "format_version": "1.0.0",
  "record_kind": "canonical",
  "id": "oir:generic:number-navigation-remote:default",
  "updated": "2026-09-12",
  "remote": {
    "name": "Generic Number and Navigation Remote",
    "manufacturer": "Generic",
    "model": "Number and Navigation Remote",
    "variant": "default",
    "device_types": [
      "generic"
    ]
  },
  "locale": "en",
  "defaults": {
    "protocol": "unknown",
    "carrier_hz": 38000
  },
  "commands": [
    {
      "id": "digit.1",
      "labels": {
        "en": "1"
      },
      "action": "select",
      "signals": [
        {
          "kind": "decoded",
          "protocol": "unknown",
          "parameters": {
            "address_hex": "0x00",
            "command_hex": "0x45",
            "code_hex": "0x0045"
          },
          "source_complete": false,
          "primary": true
        }
      ]
    },
    {
      "id": "digit.2",
      "labels": {
        "en": "2"
      },
      "action": "select",
      "signals": [
        {
          "kind": "decoded",
          "protocol": "unknown",
          "parameters": {
            "address_hex": "0x00",
            "command_hex": "0x46",
            "code_hex": "0x0046"
          },
          "source_complete": false,
          "primary": true
        }
      ]
    },
    {
      "id": "digit.3",
      "labels": {
        "en": "3"
      },
      "action": "select",
      "signals": [
        {
          "kind": "decoded",
          "protocol": "unknown",
          "parameters": {
            "address_hex": "0x00",
            "command_hex": "0x47",
            "code_hex": "0x0047"
          },
          "source_complete": false,
          "primary": true
        }
      ]
    },
    {
      "id": "digit.4",
      "labels": {
        "en": "4"
      },
      "action": "select",
      "signals": [
        {
          "kind": "decoded",
          "protocol": "unknown",
          "parameters": {
            "address_hex": "0x00",
            "command_hex": "0x44",
            "code_hex": "0x0044"
          },
          "source_complete": false,
          "primary": true
        }
      ]
    },
    {
      "id": "digit.5",
      "labels": {
        "en": "5"
      },
      "action": "select",
      "signals": [
        {
          "kind": "decoded",
          "protocol": "unknown",
          "parameters": {
            "address_hex": "0x00",
            "command_hex": "0x40",
            "code_hex": "0x0040"
          },
          "source_complete": false,
          "primary": true
        }
      ]
    },
    {
      "id": "digit.6",
      "labels": {
        "en": "6"
      },
      "action": "select",
      "signals": [
        {
          "kind": "decoded",
          "protocol": "unknown",
          "parameters": {
            "address_hex": "0x00",
            "command_hex": "0x43",
            "code_hex": "0x0043"
          },
          "source_complete": false,
          "primary": true
        }
      ]
    },
    {
      "id": "digit.7",
      "labels": {
        "en": "7"
      },
      "action": "select",
      "signals": [
        {
          "kind": "decoded",
          "protocol": "unknown",
          "parameters": {
            "address_hex": "0x00",
            "command_hex": "0x07",
            "code_hex": "0x0007"
          },
          "source_complete": false,
          "primary": true
        }
      ]
    },
    {
      "id": "digit.8",
      "labels": {
        "en": "8"
      },
      "action": "select",
      "signals": [
        {
          "kind": "decoded",
          "protocol": "unknown",
          "parameters": {
            "address_hex": "0x00",
            "command_hex": "0x15",
            "code_hex": "0x0015"
          },
          "source_complete": false,
          "primary": true
        }
      ]
    },
    {
      "id": "symbol.asterisk",
      "labels": {
        "en": "*"
      },
      "action": "select",
      "signals": [
        {
          "kind": "decoded",
          "protocol": "unknown",
          "parameters": {
            "address_hex": "0x00",
            "command_hex": "0x09",
            "code_hex": "0x0009"
          },
          "source_complete": false,
          "primary": true
        }
      ]
    },
    {
      "id": "digit.9",
      "labels": {
        "en": "9"
      },
      "action": "select",
      "signals": [
        {
          "kind": "decoded",
          "protocol": "unknown",
          "parameters": {
            "address_hex": "0x00",
            "command_hex": "0x16",
            "code_hex": "0x0016"
          },
          "source_complete": false,
          "primary": true
        }
      ]
    },
    {
      "id": "symbol.hash",
      "labels": {
        "en": "#"
      },
      "action": "select",
      "signals": [
        {
          "kind": "decoded",
          "protocol": "unknown",
          "parameters": {
            "address_hex": "0x00",
            "command_hex": "0x0D",
            "code_hex": "0x000D"
          },
          "source_complete": false,
          "primary": true
        }
      ]
    },
    {
      "id": "navigation.up",
      "labels": {
        "en": "Up"
      },
      "action": "select",
      "signals": [
        {
          "kind": "decoded",
          "protocol": "unknown",
          "parameters": {
            "address_hex": "0x00",
            "command_hex": "0x18",
            "code_hex": "0x0018"
          },
          "source_complete": false,
          "primary": true
        }
      ]
    },
    {
      "id": "navigation.left",
      "labels": {
        "en": "Left"
      },
      "action": "select",
      "signals": [
        {
          "kind": "decoded",
          "protocol": "unknown",
          "parameters": {
            "address_hex": "0x00",
            "command_hex": "0x08",
            "code_hex": "0x0008"
          },
          "source_complete": false,
          "primary": true
        }
      ]
    },
    {
      "id": "navigation.ok",
      "labels": {
        "en": "OK"
      },
      "action": "select",
      "signals": [
        {
          "kind": "decoded",
          "protocol": "unknown",
          "parameters": {
            "address_hex": "0x00",
            "command_hex": "0x1C",
            "code_hex": "0x001C"
          },
          "source_complete": false,
          "primary": true
        }
      ]
    },
    {
      "id": "navigation.right",
      "labels": {
        "en": "Right"
      },
      "action": "select",
      "signals": [
        {
          "kind": "decoded",
          "protocol": "unknown",
          "parameters": {
            "address_hex": "0x00",
            "command_hex": "0x5A",
            "code_hex": "0x005A"
          },
          "source_complete": false,
          "primary": true
        }
      ]
    },
    {
      "id": "navigation.down",
      "labels": {
        "en": "Down"
      },
      "action": "select",
      "signals": [
        {
          "kind": "decoded",
          "protocol": "unknown",
          "parameters": {
            "address_hex": "0x00",
            "command_hex": "0x52",
            "code_hex": "0x0052"
          },
          "source_complete": false,
          "primary": true
        }
      ]
    }
  ],
  "provenance": [
    {
      "source_type": "csv-import",
      "source_path": "Generic_Number_Remote/lightly-ir-remote_generic_number_remote.csv",
      "imported_at": "2026-09-12",
      "rights": "unknown",
      "notes": "Imported from the existing Lightly Excel/CSV reading format. The source does not identify the IR protocol or carrier frequency."
    }
  ],
  "validation": {
    "status": "device-tested",
    "tested_at": "2026-09-12",
    "tester": "Repository contributor",
    "evidence": [
      "Verified in the contributor's test setup using a 38 kHz carrier."
    ],
    "issues": [
      "IR protocol is not recorded in the source CSV."
    ]
  },
  "image": {
    "path": "remote.webp",
    "media_type": "image/webp",
    "width_px": 446,
    "height_px": 892,
    "size_bytes": 43438,
    "sha256": "07dcbd117aeee6e8f56b6b622b07e6afa0f1c6992f417e617646d69ab117fd64",
    "background": "transparent",
    "rights": {
      "basis": "identification-only",
      "holder": "Respective copyright holder",
      "notice": "Copyright belongs to the respective rights holder. This image is included only to identify the physical remote."
    },
    "alt": "Front view of Generic Number and Navigation Remote"
  }
}
