{
  "$schema": "../../../../schema/open-ir-remote-v1.schema.json",
  "format": "open-ir-remote",
  "format_version": "1.0.0",
  "record_kind": "canonical",
  "id": "oir:philips:htl2060-94:default",
  "updated": "2026-09-13",
  "remote": {
    "name": "Remote for Philips HTL2060/94",
    "manufacturer": "Philips",
    "model": "Unknown",
    "variant": "default",
    "device_types": [
      "soundbar"
    ],
    "controlled_devices": [
      {
        "manufacturer": "Philips",
        "model": "HTL2060/94",
        "device_type": "soundbar"
      }
    ]
  },
  "locale": "en",
  "commands": [
    {
      "id": "power",
      "labels": {
        "en": "Power"
      },
      "signals": [
        {
          "kind": "decoded",
          "parameters": {
            "address_hex": "0x00000020",
            "command_hex": "0x0000000C"
          },
          "primary": true,
          "source_complete": true
        }
      ]
    },
    {
      "id": "reset",
      "labels": {
        "en": "Reset"
      },
      "signals": [
        {
          "kind": "decoded",
          "parameters": {
            "address_hex": "0x00000020",
            "command_hex": "0x0000000E"
          },
          "primary": true,
          "source_complete": true
        }
      ]
    },
    {
      "id": "mute",
      "labels": {
        "en": "Mute"
      },
      "signals": [
        {
          "kind": "decoded",
          "parameters": {
            "address_hex": "0x00000020",
            "command_hex": "0x0000000D"
          },
          "primary": true,
          "source_complete": true
        }
      ]
    },
    {
      "id": "play.pause",
      "labels": {
        "en": "Play_Pause"
      },
      "signals": [
        {
          "kind": "decoded",
          "parameters": {
            "address_hex": "0x00000020",
            "command_hex": "0x00000030"
          },
          "primary": true,
          "source_complete": true
        }
      ]
    },
    {
      "id": "vol.up",
      "labels": {
        "en": "Vol_up"
      },
      "signals": [
        {
          "kind": "decoded",
          "parameters": {
            "address_hex": "0x00000020",
            "command_hex": "0x00000010"
          },
          "primary": true,
          "source_complete": true
        }
      ]
    },
    {
      "id": "vol.dn",
      "labels": {
        "en": "Vol_dn"
      },
      "signals": [
        {
          "kind": "decoded",
          "parameters": {
            "address_hex": "0x00000020",
            "command_hex": "0x00000011"
          },
          "primary": true,
          "source_complete": true
        }
      ]
    },
    {
      "id": "prev",
      "labels": {
        "en": "Prev"
      },
      "signals": [
        {
          "kind": "decoded",
          "parameters": {
            "address_hex": "0x00000020",
            "command_hex": "0x00000021"
          },
          "primary": true,
          "source_complete": true
        }
      ]
    },
    {
      "id": "next",
      "labels": {
        "en": "Next"
      },
      "signals": [
        {
          "kind": "decoded",
          "parameters": {
            "address_hex": "0x00000020",
            "command_hex": "0x00000020"
          },
          "primary": true,
          "source_complete": true
        }
      ]
    },
    {
      "id": "bt",
      "labels": {
        "en": "BT"
      },
      "signals": [
        {
          "kind": "decoded",
          "parameters": {
            "address_hex": "0x00000020",
            "command_hex": "0x00000086"
          },
          "primary": true,
          "source_complete": true
        }
      ]
    },
    {
      "id": "arc",
      "labels": {
        "en": "ARC"
      },
      "signals": [
        {
          "kind": "decoded",
          "parameters": {
            "address_hex": "0x00000020",
            "command_hex": "0x0000007D"
          },
          "primary": true,
          "source_complete": true
        }
      ]
    },
    {
      "id": "opt",
      "labels": {
        "en": "OPT"
      },
      "signals": [
        {
          "kind": "decoded",
          "parameters": {
            "address_hex": "0x00000020",
            "command_hex": "0x0000006C"
          },
          "primary": true,
          "source_complete": true
        }
      ]
    },
    {
      "id": "aud",
      "labels": {
        "en": "AUD"
      },
      "signals": [
        {
          "kind": "decoded",
          "parameters": {
            "address_hex": "0x00000020",
            "command_hex": "0x00000039"
          },
          "primary": true,
          "source_complete": true
        }
      ]
    },
    {
      "id": "usb",
      "labels": {
        "en": "USB"
      },
      "signals": [
        {
          "kind": "decoded",
          "parameters": {
            "address_hex": "0x00000020",
            "command_hex": "0x00000087"
          },
          "primary": true,
          "source_complete": true
        }
      ]
    }
  ],
  "provenance": [
    {
      "source_type": "upstream-reference",
      "source_path": "https://github.com/Lucaslhm/Flipper-IRDB/blob/d126fb1b6f1e114c52b4a8c19839ea65e3a9c24d/Audio_and_Video_Receivers/Philips/Philips%20Soundbar-HTL2060_94.ir",
      "source_revision": "d126fb1b6f1e114c52b4a8c19839ea65e3a9c24d",
      "imported_at": "2026-09-13",
      "rights": "CC0-1.0",
      "notes": "Flipper-IRDB contributors. File introduced in 3ae0c1473d9e96dd06fd33eeaea8d9b30b748b78 after the upstream CC0 cutoff. Original source.ir SHA-256: b5ec5deba9c014f4bb7dfa343be3498efbe4ca7905788ebb66d99b70d9b7e966. Source comments are preserved in source.ir. No image rights are asserted."
    }
  ],
  "validation": {
    "status": "imported-unverified",
    "issues": [
      "Imported decoded parameters have not been tested on hardware by Open IR contributors. Protocol names and packed parameters follow the source Flipper convention; target adapters must support that convention. No carrier frequency was measured or inferred.",
      "The source identifies the controlled equipment, not a printed handset model number."
    ]
  },
  "extensions": {
    "flipper": {
      "file_version": 1,
      "parameter_encoding": "Four little-endian source bytes converted to unsigned numeric hexadecimal; protocol names unchanged."
    }
  },
  "defaults": {
    "protocol": "RC6"
  }
}
