{
  "$schema": "../../../../schema/open-ir-remote-v1.schema.json",
  "format": "open-ir-remote",
  "format_version": "1.0.0",
  "record_kind": "canonical",
  "id": "oir:fosi-audio:zh3:default",
  "updated": "2026-09-13",
  "remote": {
    "name": "Remote for Fosi Audio ZH3",
    "manufacturer": "Fosi Audio",
    "model": "Unknown",
    "variant": "default",
    "device_types": [
      "audio-system"
    ],
    "controlled_devices": [
      {
        "manufacturer": "Fosi Audio",
        "model": "ZH3",
        "device_type": "audio-system"
      }
    ]
  },
  "locale": "en",
  "commands": [
    {
      "id": "power",
      "labels": {
        "en": "Power"
      },
      "signals": [
        {
          "kind": "decoded",
          "parameters": {
            "address_hex": "0x000082EA",
            "command_hex": "0x00008D72"
          },
          "primary": true,
          "source_complete": true
        }
      ]
    },
    {
      "id": "lcd.change",
      "labels": {
        "en": "Lcd_Change"
      },
      "signals": [
        {
          "kind": "decoded",
          "parameters": {
            "address_hex": "0x000082EA",
            "command_hex": "0x00008C73"
          },
          "primary": true,
          "source_complete": true
        }
      ]
    },
    {
      "id": "mute",
      "labels": {
        "en": "Mute"
      },
      "signals": [
        {
          "kind": "decoded",
          "parameters": {
            "address_hex": "0x000082EA",
            "command_hex": "0x00008A75"
          },
          "primary": true,
          "source_complete": true
        }
      ]
    },
    {
      "id": "vol.up",
      "labels": {
        "en": "Vol_up"
      },
      "signals": [
        {
          "kind": "decoded",
          "parameters": {
            "address_hex": "0x000082EA",
            "command_hex": "0x00008976"
          },
          "primary": true,
          "source_complete": true
        }
      ]
    },
    {
      "id": "vol.dn",
      "labels": {
        "en": "Vol_dn"
      },
      "signals": [
        {
          "kind": "decoded",
          "parameters": {
            "address_hex": "0x000082EA",
            "command_hex": "0x00008679"
          },
          "primary": true,
          "source_complete": true
        }
      ]
    },
    {
      "id": "left",
      "labels": {
        "en": "Left"
      },
      "signals": [
        {
          "kind": "decoded",
          "parameters": {
            "address_hex": "0x000082EA",
            "command_hex": "0x00008877"
          },
          "primary": true,
          "source_complete": true
        }
      ]
    },
    {
      "id": "right",
      "labels": {
        "en": "Right"
      },
      "signals": [
        {
          "kind": "decoded",
          "parameters": {
            "address_hex": "0x000082EA",
            "command_hex": "0x00008778"
          },
          "primary": true,
          "source_complete": true
        }
      ]
    },
    {
      "id": "ok",
      "labels": {
        "en": "Ok"
      },
      "signals": [
        {
          "kind": "decoded",
          "parameters": {
            "address_hex": "0x000082EA",
            "command_hex": "0x00007986"
          },
          "primary": true,
          "source_complete": true
        }
      ]
    },
    {
      "id": "change.input",
      "labels": {
        "en": "Change_Input"
      },
      "signals": [
        {
          "kind": "decoded",
          "parameters": {
            "address_hex": "0x000082EA",
            "command_hex": "0x00007F80"
          },
          "primary": true,
          "source_complete": true
        }
      ]
    },
    {
      "id": "change.output",
      "labels": {
        "en": "Change_Output"
      },
      "signals": [
        {
          "kind": "decoded",
          "parameters": {
            "address_hex": "0x000082EA",
            "command_hex": "0x00007E81"
          },
          "primary": true,
          "source_complete": true
        }
      ]
    },
    {
      "id": "change.filter",
      "labels": {
        "en": "Change_Filter"
      },
      "signals": [
        {
          "kind": "decoded",
          "parameters": {
            "address_hex": "0x000082EA",
            "command_hex": "0x00007D82"
          },
          "primary": true,
          "source_complete": true
        }
      ]
    },
    {
      "id": "change.auto",
      "labels": {
        "en": "Change_Auto"
      },
      "signals": [
        {
          "kind": "decoded",
          "parameters": {
            "address_hex": "0x000082EA",
            "command_hex": "0x00007C83"
          },
          "primary": true,
          "source_complete": true
        }
      ]
    },
    {
      "id": "home",
      "labels": {
        "en": "Home"
      },
      "signals": [
        {
          "kind": "decoded",
          "parameters": {
            "address_hex": "0x000082EA",
            "command_hex": "0x00007A85"
          },
          "primary": true,
          "source_complete": true
        }
      ]
    }
  ],
  "provenance": [
    {
      "source_type": "upstream-reference",
      "source_path": "https://github.com/Lucaslhm/Flipper-IRDB/blob/d126fb1b6f1e114c52b4a8c19839ea65e3a9c24d/Audio_and_Video_Receivers/Fossi%20Audio/Fossi_Audio_ZH3.ir",
      "source_revision": "d126fb1b6f1e114c52b4a8c19839ea65e3a9c24d",
      "imported_at": "2026-09-13",
      "rights": "CC0-1.0",
      "notes": "Flipper-IRDB contributors. File introduced in 703192d23eb127c607e5374de85fe2ea8c7e0331 after the upstream CC0 cutoff. Original source.ir SHA-256: 02c6007caf743aa7d93571e443f005c9d7f4b6b15bbbac9ef6612add42b2915c. Source comments are preserved in source.ir. No image rights are asserted."
    }
  ],
  "validation": {
    "status": "imported-unverified",
    "issues": [
      "Imported decoded parameters have not been tested on hardware by Open IR contributors. Protocol names and packed parameters follow the source Flipper convention; target adapters must support that convention. No carrier frequency was measured or inferred.",
      "The source identifies the controlled equipment, not a printed handset model number.",
      "Source spells the brand Fossi Audio. Display spelling is normalized to Fosi Audio using the manufacturer link preserved in source.ir."
    ]
  },
  "extensions": {
    "flipper": {
      "file_version": 1,
      "parameter_encoding": "Four little-endian source bytes converted to unsigned numeric hexadecimal; protocol names unchanged."
    }
  },
  "defaults": {
    "protocol": "NECext"
  }
}
